{
  "chosen_runtime": {
    "runtime": {
      "id": "wasmtime",
      "vendor": "Bytecode Alliance",
      "version": "strict-profile-2026-03"
    },
    "runtime_guarantee_digest": {
      "algorithm": "sha256",
      "value": "6a163afd329286e3e06f0f0f1200770c86fef6cd051c41882d5b0ea402224a22"
    },
    "runtime_guarantee_id": "urn:guild:runtime:wasmtime-strict:v1"
  },
  "component_digest": {
    "algorithm": "sha256",
    "value": "df78342cd5b5f401a3ab4ee69e5d42d4cbaf0d8f67f1fb8e947c3b9d93d84f8e"
  },
  "contract_digest": {
    "algorithm": "sha256",
    "value": "1888184126b0cc95b54b06e909e307d5510de8d86337d40316960ca1d1cf518f"
  },
  "contract_id": "urn:guild:contract:zero-authority:v1",
  "decision": "migrate",
  "decision_reason_codes": [
    "PREFERRED_RUNTIME_NOT_ADMISSIBLE"
  ],
  "delegation_token_policy_inputs": {
    "anti_replay_required": false,
    "audience_binding_inputs": [],
    "audience_binding_required": false,
    "call_chain_binding_required": false,
    "contract_delegation_policy": {
      "anti_replay_required": false,
      "audience_binding_required": false,
      "call_chain_binding_required": false,
      "max_hops": 0,
      "mode": "forbidden",
      "ttl_seconds_max": 300
    },
    "delegation_chain_input": {
      "caller_chain": [
        "urn:guild:actor:user"
      ],
      "requested_max_hops": 0
    },
    "max_hops_enforced_required": false,
    "required_revocation_mode": "expiry_only",
    "required_token_passthrough_mode": "forbidden",
    "resource_binding_inputs": [],
    "runtime_default_revocation_mode": "lease",
    "runtime_default_token_passthrough_mode": "forbidden"
  },
  "denied_authority": [],
  "export_name": "summarize",
  "granted_authority": {
    "delegation_policy": {
      "anti_replay_required": false,
      "audience_binding_required": false,
      "call_chain_binding_required": false,
      "max_hops": 0,
      "mode": "forbidden",
      "ttl_seconds_max": 300
    },
    "grants": [],
    "plan_id": "urn:guild:request:zero-authority:migrate:v1:granted",
    "ttl_seconds": 180
  },
  "hard_requirement_status": {
    "satisfied": true,
    "unsatisfied_requirements": []
  },
  "input_class_fingerprint": {
    "canonicalization": "rfc8785-jcs",
    "digest": {
      "algorithm": "sha256",
      "value": "26d18e0d615b0955ec36aa4b5b891dcf8865e726bc77f26b8b305fbb7f89fb68"
    },
    "kind": "json-schema-hash"
  },
  "kind": "guild.execution_plan",
  "plan_id": "urn:guild:request:zero-authority:migrate:v1:execution-plan",
  "plan_validity": {
    "contract_ttl_seconds_max": 300,
    "requested_ttl_seconds": 180,
    "source": "contract_and_request",
    "ttl_seconds": 180
  },
  "preferred_runtime_guarantee_id": "urn:guild:runtime:node-wasi-basic:v1",
  "proof_prerequisites": [
    {
      "code": "CONTRACT_DIGEST_BINDING",
      "detail": {
        "contract_digest": {
          "algorithm": "sha256",
          "value": "1888184126b0cc95b54b06e909e307d5510de8d86337d40316960ca1d1cf518f"
        }
      },
      "required": true
    },
    {
      "code": "RUNTIME_GUARANTEE_DIGEST_BINDING",
      "detail": {
        "runtime_guarantee_digest": {
          "algorithm": "sha256",
          "value": "6a163afd329286e3e06f0f0f1200770c86fef6cd051c41882d5b0ea402224a22"
        }
      },
      "required": true
    },
    {
      "code": "AUTHORITY_PLAN_DIGEST_BINDING",
      "detail": {
        "required": false
      },
      "required": false
    }
  ],
  "request_id": "urn:guild:request:zero-authority:migrate:v1",
  "request_narrowing_applied": false,
  "requested_authority": {
    "delegation_policy": {
      "anti_replay_required": false,
      "audience_binding_required": false,
      "call_chain_binding_required": false,
      "max_hops": 0,
      "mode": "forbidden",
      "ttl_seconds_max": 300
    },
    "grants": [],
    "plan_id": "urn:guild:request:zero-authority:migrate:v1:requested",
    "ttl_seconds": 180
  },
  "runtime_evaluations": [
    {
      "admissible": false,
      "chosen": false,
      "hard_requirements_satisfied": false,
      "preferred": true,
      "reason_codes": [
        "RUNTIME_CHILD_PROCESS_MODE_UNSUPPORTED",
        "RUNTIME_EXECUTION_ISOLATION_TOO_WEAK",
        "RUNTIME_FILESYSTEM_ISOLATION_TOO_WEAK",
        "RUNTIME_TOKEN_PASSTHROUGH_MODE_UNSUPPORTED"
      ],
      "runtime": {
        "id": "node-wasi",
        "vendor": "Node.js",
        "version": "basic-profile-2026-03"
      },
      "runtime_guarantee_id": "urn:guild:runtime:node-wasi-basic:v1",
      "unsatisfied_requirements": [
        {
          "reason": {
            "detail": {
              "published": "best_effort",
              "required": "strong"
            },
            "message": "runtime execution isolation assurance was weaker than required",
            "reason_code": "RUNTIME_EXECUTION_ISOLATION_TOO_WEAK"
          },
          "requirement_kind": "runtime_guarantee",
          "subject": "execution_isolation_assurance"
        },
        {
          "reason": {
            "detail": {
              "published": "path_filter",
              "required": "preopen_only"
            },
            "message": "runtime filesystem isolation class was weaker than required",
            "reason_code": "RUNTIME_FILESYSTEM_ISOLATION_TOO_WEAK"
          },
          "requirement_kind": "runtime_guarantee",
          "subject": "filesystem_isolation_class"
        },
        {
          "reason": {
            "detail": {
              "required_mode": "forbidden",
              "supported_modes": [
                "unrestricted"
              ]
            },
            "message": "runtime did not publish the required policy mode",
            "reason_code": "RUNTIME_CHILD_PROCESS_MODE_UNSUPPORTED"
          },
          "requirement_kind": "runtime_guarantee",
          "subject": "child_process_policy"
        },
        {
          "reason": {
            "detail": {
              "required_mode": "forbidden",
              "supported_modes": [
                "unrestricted"
              ]
            },
            "message": "runtime did not publish the required policy mode",
            "reason_code": "RUNTIME_TOKEN_PASSTHROUGH_MODE_UNSUPPORTED"
          },
          "requirement_kind": "runtime_guarantee",
          "subject": "token_passthrough_policy"
        }
      ]
    },
    {
      "admissible": true,
      "chosen": true,
      "hard_requirements_satisfied": true,
      "preferred": false,
      "reason_codes": [],
      "runtime": {
        "id": "wasmtime",
        "vendor": "Bytecode Alliance",
        "version": "strict-profile-2026-03"
      },
      "runtime_guarantee_id": "urn:guild:runtime:wasmtime-strict:v1",
      "unsatisfied_requirements": []
    }
  ],
  "version": "1.0.0",
  "witness_policy": {
    "acceptable_signature_modes": [
      "none",
      "runtime_key",
      "external_signer"
    ],
    "acceptable_tamper_evidence_modes": [
      "hash_chain",
      "merkle_chain"
    ],
    "contract_witness_level": "decision",
    "effective_witness_level": "decision",
    "prerequisites": [
      {
        "code": "TRUSTED_TIME_SOURCE",
        "detail": {
          "required": false
        },
        "required": false
      },
      {
        "code": "REDACTED_IO_HASHES",
        "detail": {
          "required": false
        },
        "required": false
      },
      {
        "code": "AUTHORITY_PLAN_DIGEST",
        "detail": {
          "required": false
        },
        "required": false
      },
      {
        "code": "WITNESS_TAMPER_EVIDENCE_MODE",
        "detail": {
          "acceptable_modes": [
            "hash_chain",
            "merkle_chain"
          ]
        },
        "required": true
      },
      {
        "code": "WITNESS_SIGNATURE_MODE",
        "detail": {
          "acceptable_modes": [
            "none",
            "runtime_key",
            "external_signer"
          ]
        },
        "required": true
      }
    ],
    "requested_witness_level": "decision",
    "supported_levels": [
      "summary",
      "decision",
      "hostcall",
      "full"
    ]
  }
}
