{
  "chosen_runtime": {
    "runtime": {
      "id": "wasmtime",
      "vendor": "Bytecode Alliance",
      "version": "strict-profile-2026-03"
    },
    "runtime_guarantee_digest": {
      "algorithm": "sha256",
      "value": "df1a7666fd3aa3d98229f0edcd3641bd2327178c46442eb9dbf17f508b19c74e"
    },
    "runtime_guarantee_id": "urn:guild:runtime:wasmtime-strict:v1"
  },
  "component_digest": {
    "algorithm": "sha256",
    "value": "fec4ee0d8541bab9129a83fb530d1fa0378916beabe80c7ccedbfdd0fd8421f8"
  },
  "contract_digest": {
    "algorithm": "sha256",
    "value": "6f297ea89ccd12696b30db79de1a5ce71223e33c2a0799888fb5bb553af4bff8"
  },
  "contract_id": "urn:guild:contract:fetch-transform:v1",
  "decision": "admit",
  "decision_reason_codes": [],
  "delegation_token_policy_inputs": {
    "anti_replay_required": true,
    "audience_binding_inputs": [],
    "audience_binding_required": true,
    "call_chain_binding_required": true,
    "contract_delegation_policy": {
      "anti_replay_required": true,
      "audience_binding_required": true,
      "call_chain_binding_required": true,
      "max_hops": 0,
      "mode": "forbidden",
      "ttl_seconds_max": 300
    },
    "delegation_chain_input": {
      "caller_chain": [
        "urn:guild:actor:ops-user"
      ],
      "requested_max_hops": 0
    },
    "max_hops_enforced_required": true,
    "required_revocation_mode": "lease",
    "required_token_passthrough_mode": "forbidden",
    "resource_binding_inputs": [],
    "runtime_default_revocation_mode": "lease",
    "runtime_default_token_passthrough_mode": "forbidden"
  },
  "denied_authority": [],
  "export_name": "fetch_and_transform",
  "granted_authority": {
    "delegation_policy": {
      "anti_replay_required": true,
      "audience_binding_required": true,
      "call_chain_binding_required": true,
      "max_hops": 0,
      "mode": "forbidden",
      "ttl_seconds_max": 300
    },
    "grants": [
      {
        "cardinality": {
          "max_bytes": 10485760,
          "max_calls": 100
        },
        "effect_class": "fs.read",
        "scope": {
          "follow_mounts": false,
          "kind": "filesystem",
          "paths": [
            "/workspace/input/**"
          ],
          "symlink_policy": "deny"
        }
      },
      {
        "cardinality": {
          "max_bytes": 10485760,
          "max_calls": 100
        },
        "effect_class": "fs.write",
        "scope": {
          "follow_mounts": false,
          "kind": "filesystem",
          "paths": [
            "/workspace/output/**"
          ],
          "symlink_policy": "deny"
        }
      },
      {
        "cardinality": {
          "max_bytes": 5242880,
          "max_calls": 10
        },
        "effect_class": "net.connect",
        "scope": {
          "audiences": [
            {
              "host": "api.vendor.example.com",
              "methods": [
                "GET"
              ],
              "path_prefixes": [
                "/v1/source/"
              ],
              "ports": [
                443
              ],
              "schemes": [
                "https"
              ]
            }
          ],
          "kind": "network"
        }
      },
      {
        "cardinality": {
          "max_calls": 10
        },
        "effect_class": "clock.read",
        "scope": {
          "kind": "system"
        }
      },
      {
        "cardinality": {
          "max_calls": 2
        },
        "effect_class": "secret.read",
        "scope": {
          "kind": "secret",
          "secret_ids": [
            "vault://prod/vendor/source-api-token"
          ]
        }
      }
    ],
    "plan_id": "urn:guild:request:fetch-transform:no-reduction:v1:granted",
    "ttl_seconds": 300
  },
  "hard_requirement_status": {
    "satisfied": true,
    "unsatisfied_requirements": []
  },
  "input_class_fingerprint": {
    "canonicalization": "rfc8785-jcs",
    "digest": {
      "algorithm": "sha256",
      "value": "c69ff0208dfc627c10beb81d20babffc27585fd741b1f3d8b3beb32f1e0c6f46"
    },
    "kind": "json-schema-hash"
  },
  "kind": "guild.execution_plan",
  "plan_id": "urn:guild:request:fetch-transform:no-reduction:v1:execution-plan",
  "plan_validity": {
    "contract_ttl_seconds_max": 300,
    "requested_ttl_seconds": 300,
    "source": "contract_and_request",
    "ttl_seconds": 300
  },
  "preferred_runtime_guarantee_id": "urn:guild:runtime:wasmtime-strict:v1",
  "proof_prerequisites": [
    {
      "code": "CONTRACT_DIGEST_BINDING",
      "detail": {
        "contract_digest": {
          "algorithm": "sha256",
          "value": "6f297ea89ccd12696b30db79de1a5ce71223e33c2a0799888fb5bb553af4bff8"
        }
      },
      "required": true
    },
    {
      "code": "RUNTIME_GUARANTEE_DIGEST_BINDING",
      "detail": {
        "runtime_guarantee_digest": {
          "algorithm": "sha256",
          "value": "df1a7666fd3aa3d98229f0edcd3641bd2327178c46442eb9dbf17f508b19c74e"
        }
      },
      "required": true
    },
    {
      "code": "AUTHORITY_PLAN_DIGEST_BINDING",
      "detail": {
        "required": true
      },
      "required": true
    }
  ],
  "request_id": "urn:guild:request:fetch-transform:no-reduction:v1",
  "request_narrowing_applied": false,
  "requested_authority": {
    "delegation_policy": {
      "anti_replay_required": true,
      "audience_binding_required": true,
      "call_chain_binding_required": true,
      "max_hops": 0,
      "mode": "forbidden",
      "ttl_seconds_max": 300
    },
    "grants": [
      {
        "cardinality": {
          "max_bytes": 10485760,
          "max_calls": 100
        },
        "effect_class": "fs.read",
        "scope": {
          "follow_mounts": false,
          "kind": "filesystem",
          "paths": [
            "/workspace/input/**"
          ],
          "symlink_policy": "deny"
        }
      },
      {
        "cardinality": {
          "max_bytes": 10485760,
          "max_calls": 100
        },
        "effect_class": "fs.write",
        "scope": {
          "follow_mounts": false,
          "kind": "filesystem",
          "paths": [
            "/workspace/output/**"
          ],
          "symlink_policy": "deny"
        }
      },
      {
        "cardinality": {
          "max_bytes": 5242880,
          "max_calls": 10
        },
        "effect_class": "net.connect",
        "scope": {
          "audiences": [
            {
              "host": "api.vendor.example.com",
              "methods": [
                "GET"
              ],
              "path_prefixes": [
                "/v1/source/"
              ],
              "ports": [
                443
              ],
              "schemes": [
                "https"
              ]
            }
          ],
          "kind": "network"
        }
      },
      {
        "cardinality": {
          "max_calls": 10
        },
        "effect_class": "clock.read",
        "scope": {
          "kind": "system"
        }
      },
      {
        "cardinality": {
          "max_calls": 2
        },
        "effect_class": "secret.read",
        "scope": {
          "kind": "secret",
          "secret_ids": [
            "vault://prod/vendor/source-api-token"
          ]
        }
      }
    ],
    "plan_id": "urn:guild:request:fetch-transform:no-reduction:v1:requested",
    "ttl_seconds": 300
  },
  "runtime_evaluations": [
    {
      "admissible": true,
      "chosen": true,
      "hard_requirements_satisfied": true,
      "preferred": true,
      "reason_codes": [],
      "runtime": {
        "id": "wasmtime",
        "vendor": "Bytecode Alliance",
        "version": "strict-profile-2026-03"
      },
      "runtime_guarantee_id": "urn:guild:runtime:wasmtime-strict:v1",
      "unsatisfied_requirements": []
    }
  ],
  "version": "1.0.0",
  "witness_policy": {
    "acceptable_signature_modes": [
      "runtime_key",
      "external_signer"
    ],
    "acceptable_tamper_evidence_modes": [
      "hash_chain",
      "merkle_chain"
    ],
    "contract_witness_level": "hostcall",
    "effective_witness_level": "hostcall",
    "prerequisites": [
      {
        "code": "TRUSTED_TIME_SOURCE",
        "detail": {
          "required": true
        },
        "required": true
      },
      {
        "code": "REDACTED_IO_HASHES",
        "detail": {
          "required": true
        },
        "required": true
      },
      {
        "code": "AUTHORITY_PLAN_DIGEST",
        "detail": {
          "required": true
        },
        "required": true
      },
      {
        "code": "WITNESS_TAMPER_EVIDENCE_MODE",
        "detail": {
          "acceptable_modes": [
            "hash_chain",
            "merkle_chain"
          ]
        },
        "required": true
      },
      {
        "code": "WITNESS_SIGNATURE_MODE",
        "detail": {
          "acceptable_modes": [
            "runtime_key",
            "external_signer"
          ]
        },
        "required": true
      }
    ],
    "requested_witness_level": "hostcall",
    "supported_levels": [
      "summary",
      "decision",
      "hostcall",
      "full"
    ]
  }
}
